Kaiser Glider,Monster,Effect,Light,Dragon,,6,2400,2200,This card cannot be destroyed by battle with a monster that has the same ATK. When this card is destroyed and sent to the Graveyard; Target 1 monster on the field; return that target to the hand.,Select a deck above,Junk
Kaiser Sea Horse,Monster,Effect,Light,Sea Serpent,,4,1700,1650,This card can be treated as 2 Tributes for the Tribute Summon of a LIGHT monster.,Select a deck above,Junk
Kaminari Attack,Monster,Fusion,Wind,Thunder,Normal,5,1900,1400,"Ocubeam + ""Mega Thunderball""",Select a deck above,Junk
Kaminote Blow,Spell,Normal,,,,,,,"You can only activate this card if there is at least 1 face-up ""Chu-Ske the Mouse Fighter"", ""Monk Fighter"", or ""Master Monk"" on your side of the field. Destroy the monster(s) that battle with these monsters on your side of the field this turn, at the end of each Damage Step.",Select a deck above,Junk
Kangaroo Champ,Monster,Effect,Earth,Beast,,4,800,700,A monster that battles with this card is changed to Defense Position after damage calculation.,Select a deck above,Junk
Karate Man,Monster,Effect,Earth,Warrior,,3,1000,1000,"Once per turn, the original ATK of this card can be doubled. When this effect is applied, the card is immediately destroyed at the end of the turn.",Select a deck above,Junk
Karbonala Warrior,Monster,Fusion,Earth,Warrior,Normal,4,1500,1200,"M-Warrior #1 + ""M-Warrior #2""",Select a deck above,Junk
Kazejin,Monster,Effect,Wind,Spellcaster,,7,2400,2200,Reduce the ATK of an opponent's monster attacking this card to 0. This effect can be used only once. The card's owner chooses when to activate this effect.,Select a deck above,Junk
Kelbek,Monster,Effect,Earth,Fairy,,4,1500,1800,A monster that attacks this card returns to its owner's hand. Damage calculation is applied normally.,Select a deck above,Junk
Keldo,Monster,Effect,Earth,Fairy,,4,1200,1600,"When this card is destroyed and sent to the Graveyard as a result of battle, select 2 cards from your opponent's Graveyard, add them to your opponent's Deck and the Deck is then shuffled.",Select a deck above,Junk
Killer Needle,Monster,Normal,Wind,Insect,,4,1200,1000,A huge bee with exceptional strength that's particularly dangerous in a swarm.,Select a deck above,Junk
King Dragun,Monster,Fusion,Dark,Dragon,Effect,7,2400,1100,"Lord of D. + ""Divine Dragon Ragnarok""
As long as this card remains face-up on the field, your opponent cannot target Dragon-Type monsters for the effect of a Spell, Trap, or Monster Card. Once per turn, you can Special Summon 1 Dragon-Type monster from your hand to your side of the field.",Select a deck above,Staple
King Fog,Monster,Normal,Dark,Fiend,,3,1000,900,A fiend that dwells in a blinding curtain of smoke.,Select a deck above,Junk
King of the Skull Servants,Monster,Effect,Dark,Zombie,,1,?,0,"The original ATK of this card becomes the number of ""King of the Skull Servants"" and ""Skull Servant"" cards in your Graveyard x 1000. When this card is destroyed by battle and sent to the Graveyard, by removing from play 1 other ""King of the Skull Servants"" or ""Skull Servant"" card in your Graveyard, Special Summon this card.",Select a deck above,Junk
King of the Swamp,Monster,Effect,Water,Aqua,,3,500,1100,"You can substitute this card for any 1 Fusion Material Monster. When you do this, the other Fusion Material Monster(s) must be the correct one(s). Discard this card from your hand to the Graveyard to add a ""Polymerization"" from your Deck to your hand. The Deck is then shuffled.",Select a deck above,Junk
King of Yamimakai,Monster,Normal,Dark,Fiend,,5,2000,1530,Wields the power of darkness to destroy its enemies.,Select a deck above,Junk
King Tiger Wanghu,Monster,Effect,Earth,Beast,,4,1700,1000,When a monster(s) with 1400 or less ATK is Normal Summoned or Special Summoned: Destroy those monsters with 1400 or less ATK. This card must be face-up on the field to activate and to resolve this effect.,Select a deck above,Optional
Kiryu,Monster,Effect,Dark,Dragon,Union,5,2000,1500,"Once per turn, during your Main Phase, if you control this card on the field, you can equip it to your Dark Blade"" as an Equip Card, OR unequip the Union equipment and Special Summon this card in face-up Attack Position. While equipped to a monster by this card's effect, increase the ATK/DEF of the equipped monster by 900 points, and you can Tribute this card to allow the equipped monster to attack your opponent's Life Points directly this turn. (1 monster can only be equipped with 1 Union Monster at a time. If the equipped monster is destroyed as a result of battle, destroy this card instead.)""",Select a deck above,Junk
Kiseitai,Monster,Effect,Dark,Fiend,,2,300,800,"When your opponent's monster attacks this card in face-down Defense Position, this card becomes an Equip Spell Card equipped to the attacking monster (No damage calculation is conducted). During each of your opponent's Standby Phases, increase your Life Points by half of the ATK of the monster equipped with this card.",Select a deck above,Junk
Kishido Spirit,Spell,Continuous,,,,,,,Monsters on your side of the field cannot be destroyed in a battle if the monsters' ATK are equal.,Select a deck above,Junk
Knight's Title,Spell,Normal,,,,,,,"Activate this card by offering 1 face-up ""Dark Magician"" on your side of the field as a Tribute. Special Summon 1 ""Dark Magician Knight"" from your hand, Deck or Graveyard.",Select a deck above,Junk
Koitsu,Monster,Effect,Water,Fairy,Union,10,200,100,"Once per turn, during your Main Phase, if you control this card on the field, you can equip it to your Aitsu"" as an Equip Card, OR unequip the Union equipment and Special Summon this card in face-up Attack Position. While equipped to a monster by this card's effect, increase the ATK of the equipped monster by 3000 points. When it attacks with an ATK that is higher than the DEF of a Defense Position monster, inflict the difference as Battle Damage to your opponent's Life Points. (1 monster can only be equipped with 1 Union Monster at a time. If the equipped monster is destroyed as a result of battle, destroy this card instead.)""",Select a deck above,Junk
Kojikocy,Monster,Normal,Earth,Warrior,,4,1500,1200,A man-hunter with powerful arms that can crush boulders,Select a deck above,Junk
Kotodama,Monster,Effect,Earth,Fairy,,3,0,1600,"If there are face-up monsters with the same name on the field, destroy those monsters. (If a monster is Summoned or flipped face-up that has the same name as a monster that is already face-up on the field, the new face-up monster is destroyed. If they are Summoned or flipped face-up at the same time, they are all destroyed.)",Select a deck above,Junk
Koumori Dragon,Monster,Normal,Dark,Dragon,,4,1500,1200,"A vicious, fire-breathing dragon whose wicked flame corrupts the souls of its victims.",Select a deck above,Junk
Kozaky,Monster,Normal,Dark,Fiend,,1,400,400,A workaholic fiend who devotes everything to his research into the languages of Dark World. His mind has collapsed because of working too hard.,Select a deck above,Junk
Kozaky's Self-Destruct Button,Trap,Normal,,,,,,,Inflict 1000 points of damage to the Life Points of the player who destroyed this Set card.,Select a deck above,Junk
Kryuel,Monster,Effect,Dark,Fiend,,4,1000,1700,"When this card is sent to the Graveyard as a result of battle, toss a coin and call it. If you call it right, destroy 1 monster on your opponent's side of the field.",Select a deck above,Junk
Kumootoko,Monster,Normal,Earth,Insect,,3,700,1400,"A massive, intelligent spider that traps enemies with webbing.",Select a deck above,Junk
Kurama,Monster,Normal,Wind,Winged Beast,,3,800,800,A vicious bird that attacks from the skies with its whip-like tail.,Select a deck above,Junk
Kuriboh,Monster,Effect,Dark,Fiend,,1,300,200,"During your opponent's Battle Phase, you can discard this card to reduce the Battle Damage you take from 1 of your opponent's attacking monsters to 0.",Select a deck above,Junk
Kuwagata Alpha,Monster,Normal,Earth,Insect,,4,1250,1000,A very vicious stag beetle that goes for the head.,Select a deck above,Junk
Kwagar Hercules,Monster,Fusion,Earth,Insect,Normal,6,1900,1700,"Kuwagata Alpha + ""Hercules Beetle""",Select a deck above,Junk
Kycoo the Ghost Destroyer,Monster,Effect,Dark,Spellcaster,,4,1800,700,When this card inflicts Battle Damage to your opponent: You can target up to 2 monsters in their Graveyard; banish those targets. Your opponent cannot banish cards from either player's Graveyard.,Select a deck above,Optional
La Jinn the Mystical Genie of the Lamp,Monster,Normal,Dark,Fiend,,4,1800,1000,A genie of the lamp that is at the beck and call of its master.,Select a deck above,Junk
Labyrinth of Nightmare,Trap,Continuous,,,,,,,"During the End Phase of each turn, change the Battle Positions of all face-up monsters on the turn player's side of the field.",Select a deck above,Junk
Labyrinth Tank,Monster,Fusion,Dark,Machine,Normal,7,2400,2400,"""Giga Tech Wolf"" + ""Cannon Soldier""",Select a deck above,Junk
Labyrinth Wall,Monster,Normal,Earth,Rock,,5,0,3000,These walls form a labyrinth with no exit for enemies.,Select a deck above,Junk
Lady Assailant of Flames,Monster,Effect,Fire,Pyro,Flip,4,1500,1000,FLIP: Remove 3 cards from the top of your Deck from play to inflict 800 points of Direct Damage to your opponent's Life Points.,Select a deck above,Junk
Lady Ninja Yae,Monster,Effect,Wind,Warrior,,3,1100,200,"By discarding 1 WIND monster from your hand to the Graveyard, return all Spell and Trap Cards on your opponent's side of the field to the owner's hand.",Select a deck above,Junk
Lady of Faith,Monster,Normal,Light,Spellcaster,,3,1100,800,Soothes the souls of others by chanting a mysterious spell.,Select a deck above,Junk
Lady Panther,Monster,Effect,Earth,Beast-Warrior,,4,1400,1300,Offer this face-up card as a Tribute to return 1 of your monsters destroyed in battle during this turn to the top of you Deck.,Select a deck above,Junk
Larvae Moth,Monster,Effect,Earth,Insect,,2,500,400,"This monster cannot be Normal Summoned or Set. This card can only be Special Summoned by offering Petit Moth"" as a Tribute on the 2nd of your turns after ""Petit Moth"" has been equipped with ""Cocoon of Evolution"".""",Select a deck above,Junk
Larvas,Monster,Normal,Earth,Beast,,3,800,1000,"A fast-moving, bird-like creature that strangles opposing monsters with its long, thin arms.",Select a deck above,Junk
Laser Cannon Armor,Spell,Equip,,,,,,,An Insect-Type monster equipped with this card increases its ATK and DEF by 300 points.,Select a deck above,Junk
Last Turn,Trap,Normal,,,,,,,"This card can only be activated during your opponent's turn when your Life Points are 1000 or less. Select 1 monster on your side of the field and send all other cards on the field and in their respective owner's hands to their respective Graveyards. After that, your opponent selects and Special Summons 1 monster from his/her Deck in face-up Attack Position and attacks your selected monster. (Any Battle Damage from this battle is treates as 0). The player whose monster reamins along on field at the End Phase of this turn wins the Duel. Any other case results in a DRAW.",Select a deck above,Junk
Last Will,Spell,Normal,,,,,,,"If a monster on your side of the field was sent to your Graveyard this turn, you can Special Summon 1 monster with an ATK of 1500 points or less from your Deck once during this turn. Then shuffle your Deck.",Select a deck above,Junk
Launcher Spider,Monster,Normal,Fire,Machine,,7,2200,2500,A mechanical spider with rocket launchers capable of random fire.,Select a deck above,Junk
Lava Battleguard,Monster,Effect,Earth,Warrior,,5,1550,1800,"This card gains 500 ATK for each ""Swamp Battleguard"" you control.",Select a deck above,Junk
Lava Golem,Monster,Effect,Fire,Fiend,,8,3000,2500,Cannot be Normal Summoned/Set. Must first be Special Summoned (from your hand) to your opponent's side of the field by Tributing 2 monsters they control. You cannot Normal Summon/Set the turn you Special Summon this card. During each of the controller's Standby Phases: The controller takes 1000 damage.,Select a deck above,Junk
Left Arm of the Forbidden One,Monster,Normal,Dark,Spellcaster,,1,200,300,A forbidden left arm sealed by magic. Whosoever breaks this seal will know infinite power.,Select a deck above,Junk
Left Leg of the Forbidden One,Monster,Normal,Dark,Spellcaster,,1,200,300,A forbidden left leg sealed by magic. Whosoever breaks this seal will know infinite power.,Select a deck above,Junk
Legacy Hunter,Monster,Effect,Earth,Warrior,,4,1000,1500,"When this card attacks a face-down Defense Position monster and destroys it and sends it to the Graveyard as a result of battle, your opponent returns 1 random card from their hand to their Deck. Their Deck is then shuffled.",Select a deck above,Junk
Legendary Black Belt,Spell,Equip,,,,,,,"You can only equip this card to ""Chu-Ske the Mouse Fighter"", ""Monk Fighter"", or ""Master Monk"". When the equipped monster destroys your opponent's monster and sends it to the Graveyard as a result of battle, inflict damage to your opponent's Life Points equal to the DEF of the destroyed monster.",Select a deck above,Junk
Legendary Flame Lord,Monster,Ritual,Fire,Spellcaster,Effect,7,2400,2000,"This card can only be Ritual Summoned with the Ritual Spell Card, Incandescent Ordeal"". You must also Tribute monsters whose total Levels equal 7 or more from the field or your hand. Each time you or your opponent activates 1 Spell Card, put 1 Spell Counter on this card. Remove 3 Spell Counters from this card to destroy all monsters on the field except this card.""",Select a deck above,Junk
Legendary Jujitsu Master,Monster,Effect,Earth,Rock,,3,1300,1800,A monster that battles with this Defense Position card is returned to the top of its owner's Deck at the end of the Damage Step.,Select a deck above,Junk
Legendary Sword,Spell,Equip,,,,,,,A Warrior-Type monster equipped with this card increases its ATK and DEF by 300 points.,Select a deck above,Junk
Leghul,Monster,Effect,Earth,Insect,,1,300,350,This monster may attack your opponent's Life Points directly.,Select a deck above,Junk
Lekunga,Monster,Effect,Water,Plant,,4,1700,500,"You can banish 2 WATER monsters from your Graveyard: Special Summon 1 ""Lekunga Token"" (Plant-Type/WATER/Level2/ATK 700/DEF 700) in Attack Position.",Select a deck above,Junk
Leogun,Monster,Normal,Earth,Beast,,5,1750,1550,Huge monster with a lion's mane similar to the King of Beasts.,Select a deck above,Junk
Lesser Dragon,Monster,Normal,Wind,Dragon,,4,1200,1000,A minor dragon incapable of breathing fire.,Select a deck above,Junk
Lesser Fiend,Monster,Effect,Dark,Fiend,,5,2100,1000,"As long as this monster remains face-up on the field, monsters destroyed by this monster as a result of battle are removed from play instead of being sent to the Graveyard.",Select a deck above,Junk
Level Conversion Lab,Trap,Normal,,,,,,,"Select 1 monster in your hand and show it to your opponent, then roll a six-sided die. If the result is 1, send the selected monster to the Graveyard. If the result is 2-6, the Level of the selected monster becomes equal to the result until the End Phase of this turn.",Select a deck above,Junk
Level Limit - Area B,Spell,Continuous,,,,,,,All face-up Level 4 or higher monsters on the field are in Defense Position while this card is active.,Select a deck above,Optional
Level Up!,Spell,Normal,,,,,,,"Send 1 face-up ""LV"" monster on your side of the field to the Graveyard. Special Summon a monster from your hand or Deck that is written in the card text of the sent monster, ignoring any and all Summoning conditions.",Select a deck above,Junk
Levia-Dragon - Daedalus,Monster,Effect,Water,Sea Serpent,,7,2600,1500,"You can send 1 face-up ""Umi"" you control to the Graveyard; destroy all other cards on the field.",Select a deck above,Junk
Life Absorbing Machine,Trap,Continuous,,,,,,,"During your Standby Phase, gain Life Points equal to half of the total Life Points you paid during your last turn.",Select a deck above,Junk
Light of Intervention,Trap,Continuous,,,,,,,Monster Cards cannot be Set face-down. Monsters Set in Defense Position are Normal Summoned in face-up Defense Position.,Select a deck above,Optional
Light of Judgment,Trap,Normal,,,,,,,"Activate this card by discarding 1 LIGHT Monster Card from your hand to the Graveyard while The Sanctuary in the Sky"" is on the field. Select 1 card on the field controlled by your opponent or 1 card in your opponent's hand (you can look at your opponent's hand), and send it to the Graveyard.""",Select a deck above,Junk
Lighten the Load,Spell,Continuous,,,,,,,"Add 1 Level 7 or higher monster from your hand to your Deck and shuffle it, then draw 1 card. You can only use this effect once per turn.",Select a deck above,Junk
Lightforce Sword,Trap,Normal,,,,,,,"Select 1 random card from your opponent's hand and remove it from play face-down. During your opponent's 4th Standby Phase after this card's activation, return that card to their hand.",Select a deck above,Junk
Lightning Blade,Spell,Equip,,,,,,,You can only equip this card to a Warrior-Type monster. Increase the ATK of the equipped monster by 800 points and decrease the ATK of all WATER monsters on the field by 500 points.,Select a deck above,Junk
Lightning Conger,Monster,Normal,Water,Thunder,,3,350,750,This massive eel generates huge charges of electricity and unleashes them as thunderbolts.,Select a deck above,Junk
Lightning Vortex,Spell,Normal,,,,,,,Discard 1 card. Destroy all face-up monsters your opponent controls.,Select a deck above,Optional
Limiter Removal,Spell,Quick-Play,,,,,,,"Double the ATK of all Machine-Type monsters you controlled at both the activation and resolution of this card, until the End Phase. During the End Phase, destroy those monsters.",Select a deck above,Junk
Liquid Beast,Monster,Normal,Water,Aqua,,3,950,800,A liquid life form that thrives on water.,Select a deck above,Junk
Little Chimera,Monster,Effect,Fire,Beast,,2,600,550,"As long as this card remains face-up on the field, increase the ATK of all FIRE monsters by 500 points and decrease the ATK of all WATER monsters by 400 points.",Select a deck above,Junk
Little-Winguard,Monster,Effect,Wind,Warrior,,4,1400,1800,"Once per turn, during your End Phase. You can change the battle position of this card.",Select a deck above,Junk
Lizard Soldier,Monster,Normal,Wind,Dragon,,3,1100,800,"A beast soldier derived from dragons, it is small for a Dragon-Type. Moving very quickly, this monster is an excellent strategist.",Select a deck above,Junk
Lone Wolf,Trap,Continuous,,,,,,,"You can only activate this card if there is only 1 monster on your side of the field, and it is ""Chu-Ske the Mouse Fighter"", ""Monk Fighter"", or ""Master Monk"". That monster is not destroyed as a result of battle, and is unaffected by any of your opponent's monster effects.",Select a deck above,Junk
Lord of D.,Monster,Effect,Dark,Spellcaster,,4,1200,1100,"Face-up Dragon-Type monsters cannot be targeted by Spells, Traps, or card effects.",Select a deck above,Junk
Lord of the Lamp,Monster,Normal,Dark,Fiend,,4,1400,1200,This spirit emerges from the mystic lamp and obeys the wishes of its summoner.,Select a deck above,Junk
Lord Poison,Monster,Effect,Water,Plant,,4,1500,1000,"When this card is destroyed by battle and sent to the Graveyard: Target 1 Plant-Type monster in your Graveyard, except ""Lord Poison""; Special Summon that target.",Select a deck above,Junk
Lost Guardian,Monster,Effect,Earth,Rock,,4,100,?,The original DEF of this card equals the number of your banished Rock-Type monsters * 700.,Select a deck above,Junk
Luminous Soldier,Monster,Effect,Light,Warrior,,5,2100,1400,"If this card battles with a DARK monster, increase the ATK of this card by 500 points during the Damage Step.",Select a deck above,Junk
Luminous Spark,Spell,Field,,,,,,,Increase the ATK of all LIGHT monsters by 500 and decreases their DEF by 400 points.,Select a deck above,Junk
Luster Dragon,Monster,Normal,Wind,Dragon,,4,1900,1600,"A very beautiful dragon covered with sapphire. It does not like fights, but has incredibly high attack power.",Select a deck above,Junk
Luster Dragon #2,Monster,Normal,Wind,Dragon,,6,2400,1400,"This dragon feeds on emerald. Enchanted by this monster even when attacked, few people live to tell of its beauty.",Select a deck above,Junk
M-Warrior #1,Monster,Normal,Earth,Warrior,,3,1000,500,"Specializing in combination attacks, this warrior uses magnetism to block an enemy's escape.",Select a deck above,Junk
M-Warrior #2,Monster,Normal,Earth,Warrior,,3,500,1000,"Specializing in combination attacks, this warrior is equipped with a tough, magnetically coated armor.",Select a deck above,Junk
Machine Conversion Factory,Spell,Equip,,,,,,,A Machine-Type monster equipped with this card increases its ATK and DEF by 300 points.,Select a deck above,Junk
Machine Duplication,Spell,Normal,,,,,,,Select 1 face-up Machine-Type monster you control with 500 or less ATK. You can Special Summon up to 2 cards with the same name from your Deck.,Select a deck above,Junk
Machine King,Monster,Effect,Earth,Machine,,6,2200,2000,Increase the ATK of this card by 100 points for each face-up Machine-Type monster on the field.,Select a deck above,Junk
Mad Dog of Darkness,Monster,Normal,Dark,Beast,,4,1900,1400,"He used to be a normal dog who played around in a park, but was corrupted by the powers of darkness.",Select a deck above,Junk
Mad Sword Beast,Monster,Effect,Earth,Dinosaur,,4,1400,1200,"If this card attacks a Defense Position monster, inflict piercing battle damage to your opponent.",Select a deck above,Junk
Mage Power,Spell,Equip,,,,,,,The equipped monster gains 500 ATK and DEF for each Spell and Trap Card you control.,Select a deck above,Junk
Magic Cylinder,Trap,Normal,,,,,,,"When an opponent's monster declares an attack: Target the attacking monster; negate the attack, and if you do, inflict damage to your opponent equal to its ATK.",Select a deck above,Optional
Magic Drain,Trap,Counter,,,,,,,When your opponent activates a Spell Card: Negate the activation and destroy it. Your opponent can discard 1 Spell Card to negate this card's effect.,Select a deck above,Optional
Magic Jammer,Trap,Counter,,,,,,,"When a Spell Card is activated: Discard 1 card; negate the activation, and if you do, destroy it.",Select a deck above,Borderline
Magic Reflector,Spell,Normal,,,,,,,"Select 1 Spell Card that remains face-up on your side of the field and put 1 counter on it. If the selected card is destroyed, the counter is removed instead of the card being destroyed.",Select a deck above,Junk
Magical Ghost,Monster,Normal,Dark,Zombie,,4,1300,1400,This creature casts a spell of terror and confusion just before attacking its enemies.,Select a deck above,Junk
Magical Hats,Trap,Normal,,,,,,,Activate only during your opponent's Battle Phase. Select 2 non-Monster Cards from your Deck and 1 monster you control. Shuffle those 3 cards and Set them on the field in face-down Defense Position. The 2 cards selected from your Deck are treated as monsters (ATK 0/DEF 0) and are destroyed at the end of the Battle Phase.,Select a deck above,Junk
Magical Labyrinth,Spell,Equip,,,,,,,"Equip ""Labyrinth Wall"" with this card. If you offer ""Labyrinth Wall"" equipped with this card as a Tribute, you can Special Summon ""Wall Shadow"" from your Deck.",Select a deck above,Junk
Magical Marionette,Monster,Effect,Dark,Spellcaster,,5,2000,1000,"Each time a Spell Card is activated, place 1 Spell Counter on this card. This card gains 200 ATK for each Spell Counter on it. You can remove 2 Spell Counters from this card to destroy 1 monster on the field.",Select a deck above,Junk
Magical Merchant,Monster,Effect,Light,Insect,Flip,1,200,700,FLIP: Pick up cards from the top of your Deck until you pick up a Spell Card or Trap Card. Add that card to your hand. Send the remaining cards to the Graveyard.,Select a deck above,Optional
Magical Plant Mandragola,Monster,Effect,Dark,Spellcaster,Flip,2,500,200,FLIP: Place 1 Spell Counter on each face-up card on the field that you can place a Spell Counter on.,Select a deck above,Junk
Magical Thorn,Trap,Continuous,,,,,,,"When your opponent's card(s) are discarded to the Graveyard, inflict 500 points of damage to his/her Life Points for each card that was discarded.",Select a deck above,Junk
Magician of Faith,Monster,Effect,Light,Spellcaster,Flip,1,300,400,FLIP: Add 1 Spell Card from your Graveyard to your hand.,Select a deck above,Staple
Maha Vailo,Monster,Effect,Light,Spellcaster,,4,1550,1400,This card gains 500 ATK for each Equip Card equipped to this card.,Select a deck above,Junk
Maharaghi,Monster,Effect,Earth,Rock,Spirit,4,1200,1700,"This card cannot be Special Summoned. This card returns to the owner's hand during the End Phase of the turn that this card is Normal Summoned or flipped face-up. If this card is Normal Summoned or flipped face-up, look at 1 card on the top of your Deck during your next Draw Phase (before you draw), and return the card to the top or the bottom of your Deck.",Select a deck above,Junk
Maiden of the Aqua,Monster,Effect,Water,Aqua,,4,700,2000,"As long as this card remains face-up on the field, the field is treated as Umi"" (however there is no increasing or decreasing of ATK/DEF due to ""Umi""'s effect). If there is an active Field Spell Card on the field, this effect is not applied.""",Select a deck above,Junk
Maiden of the Moonlight,Monster,Normal,Light,Spellcaster,,4,1500,1300,A sorcerer blessed by lunar light with powers far beyond mortal comprehension.,Select a deck above,Junk
Maji-Gire Panda,Monster,Effect,Earth,Beast,,4,1000,800,"As long as this card remains face-up on the field, each time a Beast-Type monster(s) on the field is destroyed, increase the ATK of this card by 500 points.",Select a deck above,Junk
