Ectoplasmer,Spell,Continuous,,,,,,,"Once during each player's End Phase, the turn player Tributes 1 face-up monster on their side of the field and inflicts damage to the opponent equal to half of the original ATK of the Tributed monster.",Select a deck above,Junk
Ekibyo Drakmord,Spell,Equip,,,,,,,"A monster equipped with this card cannot attack. At the end of the equipped monster's controller's 2nd turn after this card is activated, destroy the equipped monster. At that time, this card is returned to the owner's hand.",Select a deck above,Junk
Electric Lizard,Monster,Effect,Earth,Thunder,,3,850,800,"A non Zombie-Type monster attacking ""Electric Lizard"" cannot attack on its following turn.",Select a deck above,Junk
Electric Snake,Monster,Effect,Light,Thunder,,3,800,900,"When this card is discarded from your hand to the Graveyard by an effect of a card controlled by your opponent, draw 2 cards from your Deck.",Select a deck above,Borderline
Electro-Whip,Spell,Equip,,,,,,,A Thunder-Type monster equipped with this card increases its ATK and DEF by 300 points.,Select a deck above,Junk
Elegant Egotist,Spell,Normal,,,,,,,"If ""Harpie Lady"" is on the field: Special Summon 1 ""Harpie Lady"" or ""Harpie Lady Sisters"" from your hand or Deck.",Select a deck above,Junk
Element Doom,Monster,Effect,Dark,Fiend,,4,1500,1200,"This monster gets the following effect(s) while there is a monster(s) with the following Attribute(s) on the field:
 EARTH: Negate the effect of an Effect Monster that is destroyed by this monster as a result of battle.
 WIND: If this card destroyed your opponent's monster as a result of battle, it can attack once again in a row.",Select a deck above,Junk
Element Dragon,Monster,Effect,Light,Dragon,,4,1500,1200,"This monster gets the following effect(s) while there is a monster(s) with the following Attribute(s) on the field:
 FIRE: Increase the ATK of this card by 500 points.
 WIND: If this card destroyed your opponent's monster as a result of battle, it can attack once again in a row.",Select a deck above,Junk
Element Magician,Monster,Effect,Light,Spellcaster,,4,1500,1200,"This monster gets the following effect(s) while there is a monster(s) with the following Attribute(s) on the field:
 WATER: Control of this card cannot switch.
 WIND: If this card destroyed your opponent's monster as a result of battle, it can attack once again in a row.",Select a deck above,Junk
Element Saurus,Monster,Effect,Dark,Dinosaur,,4,1500,1200,"This monster gets the following effect(s) while there is a monster(s) with the following Attribute(s) on the field:
 FIRE: Increase the ATK of this card by 500 points.
 EARTH: Negate the effect of an Effect Monster that is destroyed by this monster as a result of battle.",Select a deck above,Junk
Element Soldier,Monster,Effect,Dark,Fiend,,4,1500,1200,"This monster gets the following effect(s) while there is a monster(s) with the following Attribute(s) on the field:
 WATER: Control of this card cannot switch.
 EARTH: Negate the effect of an Effect Monster that is destroyed by this monster in battle.",Select a deck above,Junk
Element Valkyrie,Monster,Effect,Light,Fairy,,4,1500,1200,"This monster gets the following effect(s) while there is a monster(s) with the following Attribute(s) on the field:
 FIRE: This card gains 500 ATK.
 WATER: Control of this card cannot switch.",Select a deck above,Junk
Elemental Burst,Trap,Normal,,,,,,,"Tribute 1 each of WIND, WATER, FIRE, and EARTH monsters on your side of the field to activate this card. Destroy all cards on your opponent's side of the field.",Select a deck above,Junk
Elemental HERO Avian,Monster,Normal,Wind,Warrior,,3,1000,1000,"A winged Elemental HERO who wheels through the sky and manipulates the wind. His signature move, Featherbreak, gives villainy a blow from sky-high.",Select a deck above,Junk
Elemental HERO Burstinatrix,Monster,Normal,Fire,Warrior,,3,1200,800,A flame manipulator who was the first Elemental HERO woman. Her Burstfire burns away villainy.,Select a deck above,Junk
Elemental HERO Clayman,Monster,Normal,Earth,Warrior,,4,800,2000,An Elemental HERO with a clay body built-to-last. He'll preserve his Elemental HERO colleagues at any cost.,Select a deck above,Junk
Elemental HERO Flame Wingman,Monster,Fusion,Wind,Warrior,Effect,6,2100,1200,"Elemental HERO Avian + ""Elemental HERO Burstinatrix""
Must be Fusion Summoned and cannot be Special Summoned by other ways. When this card destroys a monster by battle and sends it to the Graveyard: Inflict damage to your opponent equal to the ATK of the destroyed monster.",Select a deck above,Junk
Elemental HERO Sparkman,Monster,Normal,Light,Warrior,,4,1600,1400,An Elemental HERO and a warrior of light who proficiently wields many kinds of armaments. His Static Shockwave cuts off the path of villainy.,Select a deck above,Junk
Elemental HERO Thunder Giant,Monster,Fusion,Light,Warrior,Effect,6,2400,1500,"Elemental HERO Sparkman + ""Elemental HERO Clayman""
Must be Fusion Summoned and cannot be Special Summoned by other ways. Once per turn: You can discard 1 card to target 1 face-up monster on the field with original ATK less than the ATK of this card; destroy that target.",Select a deck above,Junk
Elemental Mistress Doriado,Monster,Ritual,Light,Spellcaster,Effect,3,1200,1400,"This card can only be Ritual Summoned with the Ritual Spell Card, ""Doriado's Blessing"". The Attribute of this card is also treated as WIND, WATER, FIRE, and EARTH.",Select a deck above,Junk
Elephant Statue of Blessing,Monster,Effect,Earth,Rock,,3,1500,0,When this card is sent from your hand to your Graveyard by an opponent's card effect: You gain 2000 Life Points.,Select a deck above,Junk
Elephant Statue of Disaster,Monster,Effect,Earth,Rock,,3,1500,0,When this card is sent from your hand to your Graveyard by an opponent's card effect: Inflict 2000 damage to your opponent.,Select a deck above,Junk
Elf's Light,Spell,Equip,,,,,,,A Light monster equipped with this card increases its ATK by 400 and decreases its DEF by 200.,Select a deck above,Junk
Emblem of Dragon Destroyer,Spell,Normal,,,,,,,"Add 1 Buster Blader"" from your Deck or your Graveyard to your hand.""",Select a deck above,Junk
Emergency Provisions,Spell,Quick-Play,,,,,,,Send any number of other Spell and Trap Cards you control to the Graveyard. Gain 1000 Life Points for each card sent.,Select a deck above,Junk
Emes the Infinity,Monster,Effect,Light,Machine,,7,2500,2000,"Each time this card destroys an opponent's monster and sends it to the Graveyard as a result of battle, increase the ATK of this card by 700 points.",Select a deck above,Junk
Emissary of the Afterlife,Monster,Effect,Dark,Fiend,,4,1600,600,"When this card is sent from the field to the Graveyard, each player selects 1 Level 3 or lower Normal Monster from their Deck, and adds it to their hand after showing it to the opponent. The Decks are then shuffled.",Select a deck above,Junk
Emissary of the Oasis,Monster,Effect,Light,Spellcaster,,3,600,400,"While a face-up Level 3 or lower Normal Monster is on your side of the field, your opponent cannot select this card as an attack target. While this card is face-up on your side of the field, any Battle Damage to the controller of this card from battle involving a Level 3 or lower Normal Monster becomes 0.",Select a deck above,Junk
Empress Judge,Monster,Fusion,Earth,Warrior,Normal,6,2100,1700,"Queen's Double + ""Hibikime""",Select a deck above,Junk
Empress Mantis,Monster,Normal,Wind,Insect,,6,2200,1400,Queen of an army of giant mantises whose command moves legions.,Select a deck above,Junk
Enchanted Javelin,Trap,Normal,,,,,,,Increase your Life Points by the ATK of 1 attacking monster.,Select a deck above,Junk
Enchanting Fitting Room,Spell,Normal,,,,,,,Pay 800 Life Points. Pick up 4 cards from the top of your Deck and Special Summon to your side of the field all Level 3 or lower Normal Monsters among the picked-up cards. Return all the other picked-up cards to your Deck and the Deck is then shuffled.,Select a deck above,Junk
Enchanting Mermaid,Monster,Normal,Water,Fish,,3,1200,900,A beautiful mermaid that lures voyagers to a watery death.,Select a deck above,Junk
Enemy Controller,Spell,Quick-Play,,,,,,,"Active 1 of these effects.
Target 1 face-up monster your opponent controls; change that target's battle position.
Tribute 1 monster, then target 1 face-up monster your opponent controls; take control of that target until the End Phase.",Select a deck above,Borderline
Energy Drain,Trap,Normal,,,,,,,"Select 1 face-up monster on your side of the field. Increase the ATK and DEF of the monster by an amount equal to the number of cards in your opponent's hand x 200 points, until the End Phase.",Select a deck above,Junk
Enervating Mist,Trap,Continuous,,,,,,,Your opponent's hand size limit becomes 5.,Select a deck above,Junk
Enraged Battle Ox,Monster,Effect,Earth,Beast-Warrior,,4,1700,1000,"As long as this card remains face-up on your side of the field, when Beast, Beast-Warrior and Winged Beast-Type monsters on your side of the field attack with an ATK that is higher than the DEF of your opponent's Defense Position monster, inflict the difference as Battle Damage to your opponent's Life Points.",Select a deck above,Borderline
Enraged Muka Muka,Monster,Effect,Earth,Rock,,5,1200,600,Increase the ATK and DEF of this card by 400 points for each card in your hand.,Select a deck above,Junk
Eria the Water Charmer,Monster,Effect,Water,Spellcaster,Flip,3,500,1500,"FLIP: Take control of 1 WATER monster on your opponent's side of the field, for as long as this card remains face-up on the field.",Select a deck above,Junk
Eternal Rest,Spell,Normal,,,,,,,Destroy all monsters equipped with Equip Cards.,Select a deck above,Junk
Exchange,Spell,Normal,,,,,,,"Each player looks at their opponent's hand, chooses 1 card in it and adds it to their own hand.",Select a deck above,Junk
Exhausting Spell,Trap,Normal,,,,,,,Remove all Spell Counters on both sides of the field.,Select a deck above,Junk
Exile of the Wicked,Spell,Normal,,,,,,,Destroy all face-up Fiend-Type monsters on the field.,Select a deck above,Junk
Exiled Force,Monster,Effect,Earth,Warrior,,4,1000,1000,You can Tribute this card to destroy 1 monster on the field.,Select a deck above,Optional
Exodia Necross,Monster,Effect,Dark,Spellcaster,,4,1800,0,"This card cannot be Normal Summoned or Set. This card cannot be Special Summoned except by the effect of ""Contract with Exodia"". This card is not destroyed as a result of battle or by the effects of Spell or Trap Cards, and during each of your Standby Phases, increase the ATK of this card by 500 points. This card is destroyed when any of ""Exodia the Forbidden One"", ""Right Arm of the Forbidden One"", ""Left Arm of the Forbidden One"", ""Right Leg of the Forbidden One"" or ""Left Leg of the Forbidden One"" is not in your Graveyard.",Select a deck above,Junk
Exodia the Forbidden One,Monster,Effect,Dark,Spellcaster,,3,1000,1000,"When you have ""Right Leg of the Forbidden One"", ""Left Leg of the Forbidden One"", ""Right Arm of the Forbidden One"" and ""Left Arm of the Forbidden One"" in addition to this card in your hand, you win the Duel.",Select a deck above,Junk
Fairy Box,Trap,Normal,,,,,,,"When your opponent's monster declares an attack: Toss a coin and call it. If you call it right, the attacking monster's ATK becomes 0 until the end of the Battle Phase. During each of your Standby Phases, pay 500 Life Points or destroy this card.",Select a deck above,Junk
Fairy Guardian,Monster,Effect,Wind,Fairy,,3,1000,1000,Offer this face-up card as a Tribute to return 1 Magic Card sent to your Graveyard by your opponent during this turn to the bottom of your Deck.,Select a deck above,Junk
Fairy King Truesdale,Monster,Effect,Water,Plant,,6,2200,1500,"While this card is in Defense Position, all Plant-Type monsters you control gain 500 ATK and DEF.",Select a deck above,Junk
Fairy Meteor Crush,Spell,Equip,,,,,,,"When a monster equipped with this card attacks with an ATK that is higher than the DEF of a Defense Position monster, inflict the difference as Battle Damage to your opponent's Life Points.",Select a deck above,Junk
Fairy of the Spring,Spell,Normal,,,,,,,Add 1 Equip Spell Card from your Graveyard to your hand. You cannot activate that Equip Spell Card this turn.,Select a deck above,Junk
Fairy's Gift,Monster,Normal,Light,Spellcaster,,4,1400,1000,This flying monster is known for delivering happiness to all.,Select a deck above,Junk
Fairy's Hand Mirror,Trap,Normal,,,,,,,When your opponent activates a Spell Card that targets exactly 1 monster (and no other cards) on the field: Target another card that would be an appropriate target; that Spell now targets the new target.,Select a deck above,Junk
Faith Bird,Monster,Normal,Wind,Winged Beast,,4,1500,1100,This long-tailed bird blinds its enemies with mystical light.,Select a deck above,Junk
Fake Trap,Trap,Normal,,,,,,,"You can only activate this card when your opponent uses an effect of a Spell, Trap, or Effect Monster to destroy Trap Card(s) on your side of the field. Destroy this card as a substitute of those Trap Card(s) and the other Trap Card(s) are not destroyed. If a Set card(s) would have been destroyed, pick up and see the Set card(s).",Select a deck above,Optional
Falling Down,Spell,Equip,,,,,,,Destroy this card if there is no Archfiend card on your side of the field. Take control of 1 of your opponent's monsters that is equipped with this card. You take 800 points of damage during each of your opponent's Standby Phases.,Select a deck above,Junk
Familiar Knight,Monster,Effect,Dark,Warrior,,3,1200,1400,"When this card is destroyed and sent to the Graveyard as a result of battle, each player can Special Summon 1 Level 4 monster from their hand.",Select a deck above,Junk
Fatal Abacus,Trap,Continuous,,,,,,,"Each time 1 monster is sent from the field to the Graveyard, inflict 500 points of damage per card to the respective card owner's Life Points.",Select a deck above,Junk
Fear from the Dark,Monster,Effect,Dark,Zombie,,4,1700,1500,When this card is sent from your hand or Deck to your Graveyard by an opponent's card effect: Special Summon this card.,Select a deck above,Junk
Fengsheng Mirror,Spell,Normal,,,,,,,Look at your opponent's hand. Select and discard 1 Spirit monster to the Graveyard if Spirit monsters exist in his/her hand.,Select a deck above,Junk
Fenrir,Monster,Effect,Water,Beast,,4,1400,1200,"This card cannot be Normal Summoned or Set. This card can only be Special Summoned by removing from play 2 WATER monsters in your Graveyard. When this card destroys an opponent's monster as a result of battle, your opponent skips their next Draw Phase.",Select a deck above,Junk
Feral Imp,Monster,Normal,Dark,Fiend,,4,1300,1400,"A playful little fiend that lurks in the dark, waiting to attack an unwary enemy.",Select a deck above,Junk
Fiend Comedian,Trap,Normal,,,,,,,"Toss a coin and call it. If you call it right, all your opponent's cards in the Graveyard are removed from play immediately. If you call it wrong, send a number of cards equal to the cards in your opponent's Graveyard from your Deck to your Graveyard.",Select a deck above,Junk
Fiend Reflection #2,Monster,Normal,Light,Winged Beast,,4,1100,1400,A bird-beast that summons reinforcements with a hand mirror.,Select a deck above,Junk
Fiend Scorpion,Monster,Normal,Earth,Insect,,2,900,200,"A huge scorpion inhabited by the soul of a fiend. Usually it holds back, but has untapped potential.",Select a deck above,Junk
Fiend Skull Dragon,Monster,Fusion,Wind,Dragon,Effect,5,2000,1200,"A Fusion Summon of this monster can only be conducted with the above Fusion Material Monsters. As long as this card remains face-up on the field, negate the effects of Flip-Effect Monsters. Negate the effects of a Trap Card that targets this card and destroy it.",Select a deck above,Staple
Fiend's Hand Mirror,Trap,Normal,,,,,,,Switch the opponent's Spell Card effect that targets 1 Spell or Trap Card to another correct target.,Select a deck above,Junk
Final Attack Orders,Trap,Continuous,,,,,,,"As long as this card remains face-up on the field, all face-up monsters on the field are changed to Attack Position and cannot change their Battle Position.",Select a deck above,Junk
Final Countdown,Spell,Normal,,,,,,,"Pay 2000 Life Points. After 20 turns have passed (counting the turn you activate this card as the 1st turn), you win the Duel.",Select a deck above,Junk
Final Destiny,Spell,Normal,,,,,,,Discard 5 cards from your hand. Destroy all cards on the field.,Select a deck above,Junk
Final Flame,Spell,Normal,,,,,,,Inflicts 600 points of Direct Damage to your opponent's Life Points.,Select a deck above,Junk
Final Ritual of the Ancients,Spell,Ritual,,,,,,,"This card is used to Ritual Summon ""Reshef the Dark Being"". You must also Tribute monsters whose total Levels equal 8 or more from the field or your hand.",Select a deck above,Junk
Fire Kraken,Monster,Normal,Fire,Aqua,,4,1600,1500,A squid that thrives on fire and heat.,Select a deck above,Junk
Fire Princess,Monster,Effect,Fire,Pyro,,4,1300,1500,"Each time you gain Life Points, inflict 500 damage to your opponent.",Select a deck above,Junk
Fire Sorcerer,Monster,Effect,Fire,Spellcaster,Flip,4,1000,1500,FLIP: Randomly select 2 cards from your hand and remove them from play to inflict 800 points of Direct Damage to your opponent's Life Points.,Select a deck above,Junk
Firebird,Monster,Effect,Fire,Winged Beast,,4,1000,800,"Each time a Winged Beast-Type monster(s) on your side of the field is destroyed, this card gains 500 ATK.",Select a deck above,Junk
Firegrass,Monster,Normal,Earth,Plant,,2,700,600,A fire-breathing plant found growing near volcanoes.,Select a deck above,Junk
Fireyarou,Monster,Normal,Fire,Pyro,,4,1300,1000,A malevolent creature wrapped in flames that attacks enemies with intense fire.,Select a deck above,Junk
Fissure,Spell,Normal,,,,,,,"Destroy the 1 face-up monster your opponent controls that has the lowest ATK. (If it's a tie, you get to choose.)",Select a deck above,Junk
Flame Cerberus,Monster,Normal,Fire,Pyro,,6,2100,1800,"Known to many as the ""Burning Executioner"", this monster is capable of burning enemies to cinders.",Select a deck above,Junk
Flame Champion,Monster,Normal,Fire,Pyro,,5,1900,1300,A warrior protected by a flaming shield that nullifies any attack.,Select a deck above,Junk
Flame Dancer,Monster,Normal,Fire,Pyro,,2,550,450,This monster moves while swinging its burning rope.,Select a deck above,Junk
Flame Ghost,Monster,Fusion,Dark,Zombie,Normal,3,1000,800,"Skull Servant + ""Dissolverock""",Select a deck above,Junk
Flame Manipulator,Monster,Normal,Fire,Spellcaster,,3,900,1000,"This Spellcaster attacks enemies with fire-related spells such as Sea of Flames"" and ""Wall of Fire"".""",Select a deck above,Junk
Flame Ruler,Monster,Effect,Fire,Pyro,,4,1500,1600,This card is treated as 2 Tributes for the Tribute Summon of a FIRE monster.,Select a deck above,Junk
Flame Swordsman,Monster,Fusion,Fire,Warrior,Normal,5,1800,1600,"""Flame Manipulator + ""Masaki the Legendary Swordsman""",Select a deck above,Junk
Flash Assailant,Monster,Effect,Dark,Fiend,,4,2000,2000,Decrease the ATK and DEF of this card by 400 points for every card in your hand.,Select a deck above,Junk
Flint,Spell,Equip,,,,,,,"A monster equipped with this card cannot change its Battle Position or attack, and has its ATK decreased by 300 points. If the equipped monster is destroyed, select 1 monster on the field and equip this card to that monster.",Select a deck above,Junk
Flower Wolf,Monster,Fusion,Earth,Beast,Normal,5,1800,1400,"Silver Fang + ""Darkworld Thorns""",Select a deck above,Junk
Flying Fish,Monster,Normal,Wind,Fish,,4,800,500,Three wishes are granted to those fortunate enough to see this monster in flight.,Select a deck above,Junk
Flying Kamakiri #1,Monster,Effect,Wind,Insect,,4,1400,900,"When this card is destroyed by battle and sent to the Graveyard: You can Special Summon 1 WIND monster with 1500 or less ATK from your Deck, in face-up Attack Position.",Select a deck above,Junk
Flying Kamakiri #2,Monster,Normal,Wind,Insect,,4,1500,800,A flying mantis that feeds primarily on insects.,Select a deck above,Junk
Flying Penguin,Monster,Normal,Water,Aqua,,4,1200,1000,A very rare penguin that takes to the air with ears shaped like wings.,Select a deck above,Junk
Follow Wind,Spell,Equip,,,,,,,A Winged Beast-Type monster equipped with this card increases its ATK and DEF by 300 points.,Select a deck above,Junk
Forced Ceasefire,Trap,Normal,,,,,,,Discard 1 card from your hand. No Trap Cards can be activated until the End Phase of this turn.,Select a deck above,Junk
Forced Requisition,Trap,Continuous,,,,,,,"You can activate this card when you discard from your hand. After that, each time you discard from your hand, your opponent must also discard the same number of cards from his/her hand.",Select a deck above,Junk
Forest,Spell,Field,,,,,,,"Increases the ATK and DEF of all Insect, Beast, Plant, and Beast-Warrior-Type monsters by 200 points.",Select a deck above,Junk
Formation Union,Trap,Normal,,,,,,,"Select and activate 1 of the following effects:
Equip 1 Union Monster on your side of the field to an appropriate monster on your side of the field as an Equip Spell Card.
Unequip 1 of your equipped Union Monsters and Special Summon it to your side of the field in face-up Attack Position.",Select a deck above,Junk
Fox Fire,Monster,Effect,Fire,Pyro,,2,300,200,"During the End Phase, if this card was destroyed by battle this turn and was face-up at the start of the Damage Step: Special Summon this card from the Graveyard. This face-up card cannot be Tributed for a Tribute Summon.",Select a deck above,Junk
Freed the Brave Wanderer,Monster,Effect,Light,Warrior,,4,1700,1200,Once per turn you can remove from play 2 LIGHT monsters in your Graveyard to destroy 1 face-up monster on the field with higher ATK than this card.,Select a deck above,Junk
Freed the Matchless General,Monster,Effect,Earth,Warrior,,5,2300,1700,Negate the effect of any Spell Card that targets this card and destroy it. You can add 1 Level 4 or lower Warrior-Type monster from your Deck to your hand instead of conducting a normal draw in your Draw Phase.,Select a deck above,Junk
Freezing Beast,Monster,Effect,Water,Aqua,Union,4,1500,1000,"Once per turn, during your Main Phase, if you control this monster on the field, you can equip it to your ""Burning Beast"" as an Equip Card, OR unequip the Union equipment and Special Summon this card in face-up Attack Position. While equipped to a monster by this card's effect, each time the equipped monster inflicts Battle Damage to your opponent, destroy 1 face-down Spell or Trap Card on the field. (1 monster can only be equipped with 1 Union Monster at a time. If the equipped monster is destroyed as a result of battle, destroy this card instead.)",Select a deck above,Junk
Frenzied Panda,Monster,Normal,Earth,Beast,,4,1200,1000,A savage beast that carries a big bamboo stick for beating down its enemies.,Select a deck above,Junk
Frontier Wiseman,Monster,Effect,Earth,Spellcaster,,3,1600,800,"As long as this card remains face-up on your side of the field, negate the effects of Spell Cards that target face-up Warrior-Type monsters on your side of the field and destroy the Spell Cards.",Select a deck above,Junk
Frontline Base,Spell,Continuous,,,,,,,"Once per turn, during your Main Phase, you can Special Summon 1 Union Monster of Level 4 or lower from your hand.",Select a deck above,Junk
Frozen Soul,Trap,Normal,,,,,,,You can only activate this card when your Life Points are at least 2000 lower than your opponent's. Skip your opponent's next Battle Phase.,Select a deck above,Junk
Fruits of Kozaky's Studies,Trap,Normal,,,,,,,Look at the top 3 cards of your Deck and return those cards to the top of the Deck in any order.,Select a deck above,Junk
Fuh-Rin-Ka-Zan,Trap,Normal,,,,,,,"When there are face-up WIND, WATER, FIRE and EARTH monster(s) on the field: Apply 1 of these effects.
Destroy all monsters your opponent controls.
Destroy all Spell and Trap Cards your opponent controls.
Discard 2 random cards from your opponent's hand.
Draw 2 cards.",Select a deck above,Junk
Fuhma Shuriken,Spell,Equip,,,,,,,"You can only equip this card to a monster that includes Ninja"" in its card name. Increase the ATK of the equipped monster by 700 points. When this card is sent from the field to the Graveyard, inflict 700 points of damage to your opponent's Life Points.""",Select a deck above,Junk
Fulfillment of the Contract,Spell,Equip,,,,,,,"Pay 800 Life Points. Select 1 Ritual Monster from your Graveyard, Special Summon it to your side of the field and equip it with this card. When this card is destroyed, remove the equipped monster from play.",Select a deck above,Junk
Fushi No Tori,Monster,Effect,Fire,Winged Beast,Spirit,4,1200,0,"This card cannot be Special Summoned. This card returns to the owner's hand during the End Phase of the turn that this card is Normal Summoned or flipped face-up. When this card inflicts Battle Damage to your opponent's Life Points, increase your Life Points by an amount equal to the Battle Damage.",Select a deck above,Junk
Fushioh Richie,Monster,Effect,Dark,Zombie,,7,2600,2900,"This card cannot be Normal Summoned or Set. This card can only be Special Summoned from your hand or your Deck by Tributing 1 Great Dezard"" that has fulfilled the condition. You can flip this card into face-down Defense Position once per turn during your Main Phase. As long as this monster remains face-up on the field, negate the activation and effects of all Spell and Trap Cards that target this card and destroy them. When this card is flipped face-up, you can Special Summon 1 Zombie-Type monster from your Graveyard.""",Select a deck above,Junk
