Pitch-Dark Dragon,Monster,Effect,Dark,Dragon,Union,3,900,600,"Once per turn, during your Main Phase, if you control this card on the field, you can equip it to your Dark Blade"" as an Equip Card, OR unequip the Union equipment and Special Summon this card in face-up Attack Position. While equipped to a monster by this card's effect, increase the ATK/DEF of the equipped monster by 400 points. When it attacks with an ATK that is higher than the DEF of a Defense Position monster, inflict the difference as Battle Damage to your opponent's Life Points. (1 monster can only be equipped with 1 Union Monster at a time. If the equipped monster is destroyed as a result of battle, destroy this card instead.)""",Select a deck above,Junk
Pixie Knight,Monster,Effect,Light,Spellcaster,,2,1300,200,"When this card is sent to the Graveyard as a result of battle, your opponent selects 1 Spell Card from your Graveyard, and places that card on the top of your Deck.",Select a deck above,Junk
Poison Fangs,Spell,Continuous,,,,,,,"Each time a Beast-Type monster inflicts Battle Damage to your opponent's Life Points, inflict 500 points of damage to your opponent's Life Points.",Select a deck above,Junk
Poison Mummy,Monster,Effect,Earth,Zombie,Flip,4,1000,1800,FLIP: Inflict 500 damage to your opponent.,Select a deck above,Junk
Poison of the Old Man,Spell,Quick-Play,,,,,,,"Activate 1 of these effects:
Gain 1200 Life Points.
Inflict 800 damage to your opponent.",Select a deck above,Optional
Pole Position,Trap,Continuous,,,,,,,"The face-up monster(s) with the highest ATK on the field is unaffected by any Spell Cards. When ""Pole Position"" is removed from the field, destroy the face-up monster(s) with the highest ATK on the field.",Select a deck above,Junk
Polymerization,Spell,Normal,,,,,,,"Fusion Summon 1 Fusion Monster from your Extra Deck, using monsters from your hand or your side of the field as Fusion Materials.",Select a deck above,Junk
Possessed Dark Soul,Monster,Effect,Dark,Fiend,,3,1200,800,Tribute this face-up monster. Take control of all face-up Level 3 or lower monsters your opponent controls until they are removed from the field.,Select a deck above,Junk
Pot of Greed,Spell,Normal,,,,,,,Draw 2 cards.,Select a deck above,Staple
Power of Kaishin,Spell,Equip,,,,,,,A Aqua-Type monster equipped with this card increases its ATK and DEF by 300 points.,Select a deck above,Junk
Precious Cards from Beyond,Spell,Continuous,,,,,,,"When you successfully Tribute Summon or Set a monster that required 2 or more Tributes, draw 2 cards from your Deck.",Select a deck above,Junk
Premature Burial,Spell,Equip,,,,,,,"Activate this card by paying 800 Life Points, then target 1 monster in your Graveyard; Special Summon that target in face-up Attack Position and equip it with this card. When this card is destroyed, destroy the equipped monster.",Select a deck above,Staple
Prevent Rat,Monster,Normal,Earth,Beast,,4,500,2000,This creature is shielded with a tough hide of hair and is excellent at defending itself.,Select a deck above,Junk
Prickle Fairy,Monster,Effect,Earth,Plant,,4,300,2000,"While this card is face-up on your side of the field, your opponent cannot attack Insect-Type monsters. The battle position of a monster that battles with this card is changed to Defense Position at the end of the Damage Step.",Select a deck above,Junk
Primal Seed,Spell,Normal,,,,,,,"If ""Black Luster Soldier - Envoy of the Beginning"" or ""Chaos Emperor Dragon - Envoy of the End"" is on the field: Target 2 of your banished cards; add both those targets to your hand.",Select a deck above,Junk
Princess of Tsurugi,Monster,Effect,Wind,Warrior,Flip,3,900,700,FLIP: Inflict 500 points of damage to your opponent's Life Points for each Spell and Trap Card on your opponent's side of the field.,Select a deck above,Optional
Prohibition,Spell,Continuous,,,,,,,"Activate by declaring 1 card name. Cards with that name, and their effects, cannot be used. Cards already on the field are not affected (including face-down cards).",Select a deck above,Borderline
Protector of the Sanctuary,Monster,Effect,Earth,Fiend,,4,1100,1900,Your opponent cannot draw cards except during Draw Phases.,Select a deck above,Junk
Protector of the Throne,Monster,Normal,Earth,Warrior,,4,800,1500,"While the king is away, this queen protects his throne with a mighty defense.",Select a deck above,Junk
Psychic Kappa,Monster,Normal,Water,Aqua,,2,400,1000,An amphibian with a myriad of powers to shield it from enemy attacks.,Select a deck above,Junk
Pumpking the King of Ghosts,Monster,Effect,Dark,Zombie,,6,1800,2000,"If ""Castle of Dark Illusions"" is face-up on the Field, increase the ATK and DEF of this card by 900 points. As long this ""Castle of Dark Illusions"" remains face-up on the Field, the ATK and DEF of this card continues to increase by 100 points during each of your Standby Phases. This effect continues until your 4th turn after this card is activated.",Select a deck above,Junk
Punished Eagle,Monster,Fusion,Wind,Winged Beast,Normal,6,2100,1800,"Blue-Winged Crown + ""Niwatori""",Select a deck above,Junk
Pyramid Energy,Spell,Quick-Play,,,,,,,"You can select and activate 1 of the following effects: 
Increase the ATK of all face-up monsters on your side of the field by 200 points until the End Phase of the turn this card is activated.
Increase the DEF of all face-up monsters on your side of the field by 500 points until the End Phase of the turn this card is activated.",Select a deck above,Junk
Pyramid of Light,Trap,Normal,,,,,,,"If this face-up card is removed from your side of the field, destroy ""Andro Sphinx"" and ""Sphinx Teleia"" on your side of the field and remove them from play.",Select a deck above,Junk
Pyramid Turtle,Monster,Effect,Earth,Zombie,,4,1200,1400,When this card is destroyed by battle and sent to the Graveyard: You can Special Summon 1 Zombie-Type monster with 2000 or less DEF from your Deck.,Select a deck above,Junk
Pyro Clock of Destiny,Trap,Normal,,,,,,,Move the turn count forward by 1 turn. The turn in which this card is activated continuous as normal.,Select a deck above,Junk
Queen Bird,Monster,Normal,Wind,Winged Beast,,5,1200,2000,This monster attacks using its huge beak.,Select a deck above,Junk
Queen of Autumn Leaves,Monster,Normal,Earth,Plant,,5,1800,1500,"Queen of the Emerald Forest and wife of the Spirit King, she lives surrounded by vivid red leaves.",Select a deck above,Junk
Queen's Double,Monster,Effect,Earth,Warrior,,1,350,300,This monster may attack your opponent's Life Points directly.,Select a deck above,Junk
Question,Spell,Normal,,,,,,,"When activating this card, your opponent cannot check cards in the Graveyard. Your opponent calls the name of the first monster found at the bottom of your Graveyard. If he/she calls it right, the monster is removed from play. If he/she calls it wrong, the monster is Special Summoned to your side of the field.",Select a deck above,Junk
Rabid Horseman,Monster,Fusion,Earth,Beast-Warrior,Normal,6,2000,1700,"Battle Ox + ""Mystic Horseman""",Select a deck above,Junk
Rafflesia Seduction,Monster,Effect,Earth,Plant,Flip,2,300,900,FLIP: Take control of 1 face-up monster on your opponent's side of the field until the end of the turn.,Select a deck above,Junk
Raging Flame Sprite,Monster,Effect,Fire,Pyro,,3,100,200,This card can attack your opponent directly. If this card inflicts Battle Damage to your opponent by a direct attack: This card gains 1000 ATK.,Select a deck above,Junk
Raigeki Break,Trap,Normal,,,,,,,Discard 1 card to target 1 card on the field; destroy it.,Select a deck above,Optional
Raimei,Spell,Normal,,,,,,,Decrease your opponent's Life Points by 300 points.,Select a deck above,Junk
Rain of Mercy,Spell,Normal,,,,,,,Increase the Life Points of both players by 1000 points.,Select a deck above,Junk
Rainbow Flower,Monster,Effect,Earth,Plant,,2,400,500,This monster may attack your opponent's Life Points directly.,Select a deck above,Junk
Raise Body Heat,Spell,Equip,,,,,,,A Dinosaur-Type monster equipped with this card increases its ATK and DEF by 300 points.,Select a deck above,Junk
Rare Metal Dragon,Monster,Effect,Dark,Dragon,,4,2400,1200,This card cannot be Normal Summoned or Set.,Select a deck above,Junk
Rare Metalmorph,Trap,Continuous,,,,,,,"Select 1 Machine-Type monster on your side of the field; it gains 500 ATK. Only once, negate the effect of a Spell Card that targets the monster. When the selected monster is removed from the field, destroy this card.",Select a deck above,Junk
Raregold Armor,Spell,Equip,,,,,,,"As long as you control the monster equipped with this card, your opponent cannot attack other monsters other than the equipped monster.",Select a deck above,Junk
Ray & Temperature,Monster,Normal,Light,Fairy,,3,1000,1000,The Sun and the North Wind join hands to deliver a devastating combination of heat and gale-force winds.,Select a deck above,Junk
Ray of Hope,Trap,Normal,,,,,,,Add 2 LIGHT monsters from your Graveyard to your Deck and shuffle it.,Select a deck above,Junk
Re-Fusion,Spell,Equip,,,,,,,"Pay 800 Life Points. Select 1 Fusion Monster from your Graveyard, Special Summon it to your side of the field and equip it with this card. When this card is destroyed, remove the equipped monster from play.",Select a deck above,Junk
Ready for Intercepting,Trap,Normal,,,,,,,Target 1 face-up Warrior or Spellcaster-Type monster on the field; change that target to face-down Defense Position.,Select a deck above,Junk
Really Eternal Rest,Trap,Normal,,,,,,,Destroy all monsters equipped with an Equip Card(s).,Select a deck above,Junk
Reaper of the Cards,Monster,Effect,Dark,Fiend,Flip,5,1380,1930,"FLIP: Select 1 Trap Card on the field and destroy it. If the selected card is Set, pick up and see the card. If it is a Trap Card, it is destroyed. If it is a Spell Card, return it to its original position.",Select a deck above,Junk
Reaper on the Nightmare,Monster,Fusion,Dark,Zombie,Effect,5,800,600,"Spirit Reaper + ""Nightmare Horse""
This card is not destroyed as a result of battle. Destroy this card when it is targeted by the effect of a Spell, Trap, or Effect Monster. This card can attack your opponent's Life Points directly even if there is a monster on your opponent's side of the field. If this card successfully attacks your opponent's Life Points directly, your opponent discards 1 card randomly from his/her hand.""",Select a deck above,Staple
Reasoning,Spell,Normal,,,,,,,"Your opponent declares a monster Level. Reveal cards from the top of your Deck until you reveal a monster that can be Normal Summoned. If that monster is the same Level as the one declared by your opponent, send all revealed cards to the Graveyard. If not, Special Summon the revealed monster, also send the remaining cards to the Graveyard.",Select a deck above,Staple
Reckless Greed,Trap,Normal,,,,,,,Draw 2 cards and skip your next 2 Draw Phases.,Select a deck above,Optional
Recycle,Spell,Continuous,,,,,,,"During your Standby Phase, by paying 300 Life Points, select 1 non-Monster Card in your Graveyard and return it to the bottom of your Deck.",Select a deck above,Junk
Red Archery Girl,Monster,Normal,Water,Aqua,,4,1400,1500,"A mermaid archer that hides in a protective shell, waiting for the right moment to strike.",Select a deck above,Junk
Red Medicine,Spell,Normal,,,,,,,Increase your Life Points by 500 points.,Select a deck above,Junk
Red-Eyes B. Dragon,Monster,Normal,Dark,Dragon,,7,2400,2000,A ferocious dragon with a deadly attack.,Select a deck above,Junk
Red-Eyes Black Metal Dragon,Monster,Effect,Dark,Machine,,8,2800,2400,"Cannot be Normal Summoned/Set. Must first be Special Summoned (from your Deck) by Tributing ""Red-Eyes B. Dragon"" equipped with ""Metalmorph"".",Select a deck above,Junk
Red-Eyes Darkness Dragon,Monster,Effect,Dark,Dragon,,9,2400,2000,"Cannot be Normal Summoned/Set. Must be Special Summoned (from your hand) by Tributing 1 ""Red-Eyes B. Dragon"" and cannot by Special Summoned by other ways. This card gains 300 ATK for each Dragon-Type monster in your Graveyard.",Select a deck above,Junk
Reflect Bounder,Monster,Effect,Light,Machine,,4,1700,1000,"When this face-up Attack Position monster is attacked by a monster on your opponent's side of the field, before damage calculation, this card inflicts damage to your opponent's Life Points equal to the ATK of the attacking monster. Then, after damage calculation, this card is destroyed.",Select a deck above,Junk
Regenerating Mummy,Monster,Effect,Dark,Zombie,,4,1800,1500,When this card is sent from your hand to your Graveyard by an opponent's card effect: Return this card to the hand.,Select a deck above,Junk
Reinforcement of the Army,Spell,Normal,,,,,,,Add 1 Level 4 or lower Warrior-Type monster from your Deck to your hand.,Select a deck above,Staple
Reinforcements,Trap,Normal,,,,,,,Increase the ATK of 1 face-up monster on the field by 500 points until the end of this turn.,Select a deck above,Junk
Release Restraint,Spell,Normal,,,,,,,"Tribute 1 ""Gearfried the Iron Knight""; Special Summon 1 ""Gearfried the Swordmaster"" from your hand or Deck.",Select a deck above,Junk
Relinquished,Monster,Ritual,Dark,Spellcaster,Effect,1,0,0,"Once per turn, select 1 monster your opponent controls and equip it to this card (only 1 monster can be equipped to it at a time). This card's ATK and DEF become equal to the ATK and DEF of the monster equipped to this card. If this card is destroyed by battle, the equipped monster is destroyed instead, and any battle damage you received from the battle is also inflicted to your opponent.",Select a deck above,Junk
Reload,Spell,Quick-Play,,,,,,,Add all cards in your hand to your Deck and shuffle it. Then draw the same number of cards that you added to your Deck.,Select a deck above,Staple
Remove Brainwashing,Trap,Continuous,,,,,,,"As long as this card remains face-up on the field, the control of all monsters on the field returns to the original owners.",Select a deck above,Junk
Remove Trap,Spell,Normal,,,,,,,Destroys 1 face-up Trap Card on the field.,Select a deck above,Junk
Rescue Cat,Monster,Effect,Earth,Beast,,4,300,100,You can send this face-up card to the Graveyard to Special Summon 2 Level 3 or lower Beast-Type monsters from your Deck. Those monsters are destroyed during the End Phase.,Select a deck above,Junk
Reshef the Dark Being,Monster,Ritual,Light,Fiend,Effect,8,2500,1500,"This card can only be Ritual Summoned with the Ritual Spell Card, ""Final Ritual of the Ancients"". Discard 1 Spell Card from your hand. Take control of 1 monster on your opponent's side of the field until the End Phase. You can only use this effect once per turn.",Select a deck above,Junk
Respect Play,Trap,Continuous,,,,,,,"During their respective turns, each player must show their opponent their hand.",Select a deck above,Junk
Restructer Revolution,Spell,Normal,,,,,,,Inflict 200 points of damage to your opponent's Life Points for each card in your opponent's hand.,Select a deck above,Junk
Return from the Different Dimension,Trap,Normal,,,,,,,"Pay half your Life Points. Special Summon as many of your banished monsters as possible. During the End Phase, banish all monsters that were Special Summoned by this effect.",Select a deck above,Optional
Return of the Doomed,Spell,Normal,,,,,,,Discard 1 Monster Card from your hand to the Graveyard. Return 1 of your monsters that is destroyed as a result of battle and sent to your Graveyard during this turn to your hand at the end of this turn.,Select a deck above,Junk
Reversal Quiz,Spell,Normal,,,,,,,"Send all cards in your hand and on your side of the field to the Graveyard. Call the type of card (Spell, Trap, or Monster) on top of your Deck. If you call it right, exchange your current Life Points with your opponent's current ones.",Select a deck above,Junk
Reverse Trap,Trap,Normal,,,,,,,All increases and decreases to ATK and DEF are reversed for the turn in which this card is activated.,Select a deck above,Junk
Revival Jam,Monster,Effect,Water,Aqua,,4,1500,500,When this card is destroyed by battle and sent to the Graveyard: You can pay 1000 Life Points; Special Summon it in face-up Defense Position during your next turn's Standby Phase.,Select a deck above,Junk
Revival of Dokurorider,Spell,Ritual,,,,,,,"This card is used to Ritual Summon Dokurorider"". You must also offer monsters whose total Level Stars equal 6 or more as a Tribute from the field or your hand.""",Select a deck above,Junk
Right Arm of the Forbidden One,Monster,Normal,Dark,Spellcaster,,1,200,300,A forbidden right arm sealed by magic. Whosoever breaks this seal will know infinite power.,Select a deck above,Junk
Right Leg of the Forbidden One,Monster,Normal,Dark,Spellcaster,,1,200,300,A forbidden right leg sealed by magic. Whosoever breaks this seal will know infinite power.,Select a deck above,Junk
Ring of Destruction,Trap,Normal,,,,,,,"Target 1 face-up monster on the field; destroy that target, and if you do, inflict damage to both players equal to that target's ATK.",Select a deck above,Staple
Ring of Magnetism,Spell,Equip,,,,,,,"You can only equip this card to a monster on your side of the field. Decrease the ATK and DEF of a monster equipped with this card by 500 points. In addition, all the monsters on your opponent's side of the field can only attack the monster equipped with this card, if they attack.",Select a deck above,Junk
Riryoku,Spell,Normal,,,,,,,"Select 2 face-up monsters on the field. Halve the ATK of 1 monster, and add that amount to the ATK of the other monster, until the End Phase.",Select a deck above,Junk
Riryoku Field,Trap,Counter,,,,,,,Negate the activation of a Spell Card that targets 1 monster on the field and destroy the Spell Card.,Select a deck above,Junk
Rising Air Current,Spell,Field,,,,,,,Increase the ATK of all WIND monsters by 500 and decreases their DEF by 400 points.,Select a deck above,Junk
Rite of Spirit,Trap,Normal,,,,,,,"Select 1 ""Gravekeeper's"" monster in your Graveyard and Special Summon it. This card's activation and effect are unaffected by ""Necrovalley"".",Select a deck above,Junk
Ritual Weapon,Spell,Equip,,,,,,,This card can only be equipped to a Ritual Monster of Level 6 or less. Increase the ATK and DEF of the equipped monster by 1500 points.,Select a deck above,Junk
Rivalry of Warlords,Trap,Continuous,,,,,,,Each player can only control 1 Type of monster. Send all other face-up monsters they control to the Graveyard.,Select a deck above,Junk
Roaring Ocean Snake,Monster,Fusion,Water,Aqua,Normal,6,2100,1800,"Mystic Lamp + ""Hyosube""",Select a deck above,Staple
Robbin' Goblin,Trap,Continuous,,,,,,,"Each time a monster you control inflicts Battle Damage to your opponent, your opponent discards 1 random card.",Select a deck above,Junk
Robolady,Monster,Normal,Earth,Machine,,3,450,900,"A warrior fully covered with metal. It upgrades by fusing with ""Roboyarou"".",Select a deck above,Junk
Robotic Knight,Monster,Normal,Fire,Machine,,4,1600,1800,"The Commander of Machine-Types, he serves the Machine King. He is famous for the way he controls his troops.",Select a deck above,Junk
Roboyarou,Monster,Normal,Earth,Machine,,3,900,450,"A warrior fully covered with metal. It upgrades by fusing with ""Robolady"".",Select a deck above,Junk
Roc from the Valley of Haze,Monster,Effect,Wind,Winged Beast,,6,2400,1400,"When this card is sent directly from your hand to the Graveyard, add this card to the Deck and shuffle it.",Select a deck above,Junk
Rock Bombardment,Trap,Normal,,,,,,,Send 1 Rock-Type monster from your Deck to the Graveyard; inflict 500 damage to your opponent.,Select a deck above,Junk
Rock Ogre Grotto #1,Monster,Normal,Earth,Rock,,3,800,1200,"Protected by a solid body of rock, this monster throws a bone-shattering punch.",Select a deck above,Junk
Rocket Jumper,Monster,Effect,Earth,Rock,,3,1000,800,"If the only cards on your opponent's side of the field are Defense Position monsters, this card can attack your opponent's Life Points directly.",Select a deck above,Junk
Rod of Silence - Kay'est,Spell,Equip,,,,,,,Increase the DEF of a monster equipped with this card by 500 points. Negate the effect of a Spell Card (excluding this card) that targets the monster equipped with this card and destroy the Spell Card.,Select a deck above,Junk
Rod of the Mind's Eye,Spell,Equip,,,,,,,"When a monster equipped with this card inflicts Battle Damage to your opponent, the damage becomes 1000 points.",Select a deck above,Junk
Rogue Doll,Monster,Normal,Light,Spellcaster,,4,1600,1000,"A deadly doll gifted with mystical power, it is particularly powerful when attacking against dark forces.",Select a deck above,Junk
Root Water,Monster,Normal,Water,Fish,,3,900,800,An amphibian capable of calling up a massive tidal wave from the dark seas to wipe out enemy monsters.,Select a deck above,Junk
Rope of Life,Trap,Normal,,,,,,,"When a monster(s) is destroyed by battle and sent to your Graveyard: Discard your entire hand to target 1 of those monsters; Special Summon it, and if you do, it gains 800 ATK.",Select a deck above,Junk
Roulette Barrel,Monster,Effect,Light,Machine,,4,1000,2000,"Once per turn, during your Main Phase, you can roll a six-sided die twice. Select one result and destroy 1 face-up monster on the field whose level is equal to the result.",Select a deck above,Optional
Royal Command,Trap,Continuous,,,,,,,Negate the activation and effects of all Flip Effect monsters effects.,Select a deck above,Junk
Royal Decree,Trap,Continuous,,,,,,,Negate all other Trap Card effects on the field.,Select a deck above,Optional
Royal Keeper,Monster,Effect,Earth,Zombie,,4,1600,1700,"Once per turn, you can flip this card into face-down Defense Position. When this card is flipped face-up, it gains 300 ATK and DEF until the end of the turn. (If attacked, this effect resolves after damage calculation.)",Select a deck above,Junk
Royal Magical Library,Monster,Effect,Light,Spellcaster,,4,0,2000,"Each time a Spell Card is activated, place 1 Spell Counter on this card (max 3). You can remove 3 Spell Counters from this card to draw 1 card.",Select a deck above,Junk
Royal Oppression,Trap,Continuous,,,,,,,"Either player can pay 800 Life Points to negate the Special Summon of a monster(s), and/or an effect that Special Summons a monster(s), and destroy those cards.",Select a deck above,Optional
Royal Surrender,Trap,Counter,,,,,,,You can only activate this card when your opponent activates a Continuous Trap Card. Negate the activation and the effect of the card and destroy it.,Select a deck above,Junk
Royal Tribute,Spell,Normal,,,,,,,"Activate only while you control ""Necrovalley"". Both players discard all Monster Cards in their hands.",Select a deck above,Junk
Rude Kaiser,Monster,Normal,Earth,Beast-Warrior,,5,1800,1600,"With an axe in each hand, this monster delivers heavy damage.",Select a deck above,Junk
Rush Recklessly,Spell,Quick-Play,,,,,,,Target face-up monster gains 700 ATK until the End Phase.,Select a deck above,Junk
Ryu Kokki,Monster,Effect,Dark,Zombie,,6,2400,2000,"At the end of the Damage Step, if this card battled a Warrior or Spellcaster-Type monster: Destroy that monster.",Select a deck above,Junk
Ryu Senshi,Monster,Fusion,Earth,Warrior,Effect,6,2000,1200,"A Fusion Summon of this monster can only be conducted with the above Fusion Material Monsters. As long as this card remains face-up on the field, negate the effect of a Normal Trap Card by paying 1000 Life Points. Negate the effect of a Spell Card that targets this card and destroy it.",Select a deck above,Staple
Ryu-Kishin,Monster,Normal,Dark,Fiend,,3,1000,500,A very elusive creature that looks like a harmless statue until it attacks.,Select a deck above,Junk
Ryu-Kishin Clown,Monster,Effect,Dark,Fiend,,2,800,500,"When this card is Summoned (including Flip Summon and Special Summon), select 1 face-up monster on the field and change its battle position.",Select a deck above,Junk
Ryu-Kishin Powered,Monster,Normal,Light,Fiend,,4,1600,1200,A gargoyle enhanced by the powers of darkness. Very sharp talons make it a worthy opponent.,Select a deck above,Junk
Ryu-Ran,Monster,Normal,Fire,Dragon,,7,2200,2600,A vicious little dragon sheltered in an egg that looks deceptively harmless.,Select a deck above,Junk
Sacred Crane,Monster,Effect,Light,Winged Beast,,4,1600,400,"When this card is Special Summoned, the controller of this card draws 1 card.",Select a deck above,Staple
Sacred Phoenix of Nephthys,Monster,Effect,Fire,Winged Beast,,8,2400,1600,During your next Standby Phase after this card was destroyed by a card effect and sent to the Graveyard: Special Summon this card from the Graveyard. When this card is Special Summoned this way: Destroy all Spell and Trap Cards on the field.,Select a deck above,Borderline
Sage's Stone,Spell,Normal,,,,,,,"Activate only if you control a face-up ""Dark Magician Girl"". Special Summon 1 ""Dark Magician"" from your hand or Deck.",Select a deck above,Junk
Saggi the Dark Clown,Monster,Normal,Dark,Spellcaster,,3,600,1500,This clown appears from nowhere and executes very strange moves to avoid enemy attacks.,Select a deck above,Junk
Sakuretsu Armor,Trap,Normal,,,,,,,Activate only when an opponent's monster declares an attack. Destroy the attacking monster.,Select a deck above,Staple
Salamandra,Spell,Equip,,,,,,,Equip only to a FIRE monster; it gains 700 ATK.,Select a deck above,Junk
Salvage,Spell,Normal,,,,,,,"Select 2 WATER monsters with 1500 or less ATK in your Graveyard, and add them to your hand.",Select a deck above,Junk
Sand Gambler,Monster,Effect,Light,Spellcaster,,3,300,1600,"Toss a coin 3 times. If all 3 results are Heads, destroy all monsters on your opponent's side of the field. If all 3 results are Tails, destroy all monsters on your side of the field. You can only activate this effect once per turn, during your Main Phase.",Select a deck above,Junk
Sand Stone,Monster,Normal,Earth,Rock,,5,1300,1600,"Appears from underground and attacks with long, snake-like tentacles.",Select a deck above,Junk
